{
  "id": "quote-missing-001",
  "profile": "evidence",
  "description": "Quote not found in the canonical text fails (EVIDENCE_NOT_IN_SOURCE).",
  "input": {
    "manifest": {
      "schema_version": "0.2.0",
      "source": {
        "id": "conf-doc"
      },
      "actions": [
        {
          "id": "act_001",
          "kind": "event",
          "title": "秋の遠足",
          "modality": "required",
          "actor": {
            "certainty": "unknown"
          },
          "temporal": {
            "type": "exact",
            "date": "2026-10-15",
            "raw_text": "令和8年10月15日"
          },
          "evidence": [
            {
              "source_id": "conf-doc",
              "text": "この文書に存在しない引用"
            }
          ],
          "inference": "explicit",
          "status": "proposed"
        }
      ]
    },
    "document": {
      "id": "conf-doc",
      "text": "令和8年10月15日に秋の遠足を実施します。\n参加を希望する方は、10月5日までに参加確認票を提出してください。"
    }
  },
  "expected": {
    "actions": {
      "act_001": {
        "evidence_supported": false,
        "passed": false
      }
    }
  }
}
